{
  "body_cell_id": "BODY-LATTICE-001",
  "repo_root": "/Volumes/PixelTable/VW_iTWIN_Bridge/VW_iTwin_Bridge",
  "gate_id": "verification",
  "gate_version": "0.1.0",
  "score": 62,
  "status": "amber",
  "goal_path": "meta/harness/fre/GOAL.md",
  "golden_path": "meta/harness/fre/GOLDENPATH.md",
  "verifier_paths": [
    "meta/harness/fre/harness/validate_schema.py",
    "meta/harness/fre/harness/validate_examples.py",
    "meta/harness/fre/tests/test_document_contract.py"
  ],
  "proof_artifacts": [
    "meta/harness/fre/evaluation/artifacts-inventory.json",
    "meta/harness/fre/promotion/artifacts-inventory.json"
  ],
  "comparison_engine": "infranodus",
  "comparison_artifacts": [
    "analysis/infranodus/goal-vs-implementation.diff.json",
    "analysis/infranodus/infranodus-schema-map.md"
  ],
  "library_refs": [
    "meta/harness/library.yaml",
    "meta/harness/agentics-library.md"
  ],
  "substrate_refs": [
    "meta/harness/pixeltable-operational-substrate.md",
    "meta/ARCHITECTURE.md"
  ],
  "substrate_bindings": {
    "table_families": [
      "lattice/execution/runs",
      "lattice/execution/evidence"
    ],
    "artifact_namespaces": [
      "meta/harness/fre/evaluation",
      "meta/harness/fre/promotion"
    ],
    "udf_refs": [
      "@pxt.udf",
      "computed_columns"
    ]
  },
  "blockers": [
    "Broader worktree parity is still pending."
  ],
  "timestamp": "2026-05-18T04:47:41Z"
}
